{
  "date": "2026-05-25",
  "weekday": "월",
  "generatedAt": "2026-05-25T08:05:00+09:00",
  "us": {
    "subNote": "美·英·韓 트리플 휴장일 — 5/22(금) 마감값 기준, 이란 MOU 기대에 장외 유가 $100 아래로",
    "subNoteEm": "트리플 휴장일",
    "comment": "오늘은 美 메모리얼데이·英 스프링 뱅크홀리데이·韓 부처님오신날 대체공휴일이 겹쳐 주요 3개국 시장이 모두 멈춰 있어요. 직전 거래일 기준값을 표시하며 <b style=\"color:var(--red);\">이란 MOU 세부 조항이 5/24 공개되며 Brent 유가가 장외에서 $100 아래로 내려왔어요</b>. 5/26(화) 全面 재개장이에요.",
    "indices": [
      { "name": "S&P 500", "tip": "5/22(금) 종가", "value": "7,473.47", "change": "▲ 0.37%", "dir": "up" },
      { "name": "나스닥 종합", "tip": "5/22(금) 종가", "value": "26,343.97", "change": "▲ 0.19%", "dir": "up" },
      { "name": "다우 산업", "tip": "5/22(금) 종가", "value": "50,579.70", "change": "▲ 0.58%", "dir": "up" },
      { "name": "필라델피아 반도체", "tip": "SOXX ETF 대용", "value": "537.33", "change": "▲ 2.41%", "dir": "up" }
    ],
    "indicators": [
      { "key": "VIX", "value": "16.64 ▼", "dir": "down" },
      { "key": "美 10년물", "value": "4.56%", "dir": "neutral" },
      { "key": "달러 인덱스", "value": "99.32", "dir": "neutral" },
      { "key": "WTI 유가", "value": "96.60달러", "dir": "neutral" },
      { "key": "금", "value": "4,516.75달러", "dir": "neutral" },
      { "key": "비트코인", "value": "77,447달러", "dir": "neutral" }
    ],
    "sectorsUp": [
      { "name": "헬스케어 (XLV)", "change": "+1.17%" },
      { "name": "IT (XLK)", "change": "+1.00%" },
      { "name": "유틸리티 (XLU)", "change": "+0.78%" },
      { "name": "산업재 (XLI)", "change": "+0.73%" },
      { "name": "에너지 (XLE)", "change": "+0.61%" }
    ],
    "sectorsDown": [
      { "name": "커뮤니케이션 (XLC)", "change": "−0.55%" },
      { "name": "부동산 (XLRE)", "change": "+0.13%" },
      { "name": "필수소비재 (XLP)", "change": "+0.17%" },
      { "name": "임의소비재 (XLY)", "change": "+0.40%" },
      { "name": "금융 (XLF)", "change": "+0.41%" }
    ]
  },
  "world": {
    "subNote": "이란 MOU 세부 조항 공개로 유가 하락, 5/28 美 PCE·韓 금통위·美 GDP 트리플 이벤트가 이번 주 분수령이에요",
    "subNoteEm": "5/28 트리플 이벤트",
    "global": [
      {
        "rank": "01",
        "category": "지정학",
        "categoryStyle": "geo",
        "sentiment": "pos",
        "title": "美·이란 MOU 초안 공개 — 60일 휴전·호르무즈 개방·120억달러 동결자산 해제",
        "summary": "Axios 단독 보도로 MOU 초안 세부가 드러났어요. 60일 휴전·지뢰 제거·원유 수출 재개·핵 협상 로드맵이 포함됐고 합의까지 수일 내외로 전망돼요.",
        "source": "Axios",
        "sourceUrl": "https://www.axios.com/2026/05/24/iran-deal-strait-hormuz-sanctions-nuclear",
        "note": "유가·해운·항공 동시 변동성"
      },
      {
        "rank": "02",
        "category": "원자재",
        "categoryStyle": "geo",
        "sentiment": "pos",
        "title": "Brent 유가 $97.90 — 이란 협상 진전에 $100 이하 첫 붕괴",
        "summary": "5/25 아시아·유럽 장외 거래에서 Brent가 5.5% 급락해 한 달 만에 $100 아래로 내려왔어요. WTI도 동반 하락 흐름이에요.",
        "source": "Washington Times",
        "sourceUrl": "https://www.washingtontimes.com/news/2026/may/25/oil-prices-dip-markets-anticipate-potential-us-iran-peace-deal/",
        "note": "에너지·항공주 수혜 기대"
      },
      {
        "rank": "03",
        "category": "정책",
        "categoryStyle": "default",
        "sentiment": "neu",
        "title": "美·英·韓 주요 시장 트리플 휴장 — 5/26 전면 재개",
        "summary": "美 메모리얼데이·英 스프링 뱅크홀리데이·韓 부처님오신날 대체공휴일이 겹쳐 글로벌 유동성이 크게 얇아졌어요. 정상 거래는 5/26(화)부터예요.",
        "source": "Yahoo Finance",
        "sourceUrl": "https://finance.yahoo.com/markets/world-indices/articles/markets-open-memorial-day-see-133936955.html",
        "note": "5/26 재개장 변동성 주목"
      },
      {
        "rank": "04",
        "category": "통화정책",
        "categoryStyle": "default",
        "sentiment": "neu",
        "title": "케빈 워시 연준 의장 공식 취임 — 첫 FOMC 6/16~17, 금리인하 기대 후퇴",
        "summary": "5/22 백악관에서 공식 취임한 워시 의장은 독립성을 강조하면서도 PCE·이란전쟁 인플레 압력을 마주했어요. 시장은 2026년 내내 동결 또는 2027년 초 인상을 점쳐요.",
        "source": "CNBC",
        "sourceUrl": "https://www.cnbc.com/2026/05/22/trump-kevin-warsh-fed-chair-interest-rates.html",
        "note": "6/17 의장 첫 기자회견 대기"
      },
      {
        "rank": "05",
        "category": "거시",
        "categoryStyle": "default",
        "sentiment": "neg",
        "title": "美 휘발유 $4.56/갤런 — 4년 만에 최고, 메모리얼데이 직격탄",
        "summary": "이란전쟁 발 고유가가 메모리얼데이 이동 수요와 맞물려 2022년 이후 가장 높은 주유비를 기록했어요. AAA는 하계 내내 고유가 지속을 경고해요.",
        "source": "CNBC",
        "sourceUrl": "https://www.cnbc.com/2026/05/22/gas-price-iran-war-strait-hormuz-memorial-day.html",
        "note": "소비여력 추가 잠식 우려"
      },
      {
        "rank": "06",
        "category": "AI",
        "categoryStyle": "tech",
        "sentiment": "pos",
        "title": "엔비디아 1Q26 매출 $81.6B — 데이터센터 92%↑, AI 수요 절정 확인",
        "summary": "순이익 $58.3B로 역대 최고를 갈아치운 엔비디아는 AI 버블 우려를 불식시켰고 소프트뱅크 주가도 20% 급등했어요.",
        "source": "Al Jazeera",
        "sourceUrl": "https://www.aljazeera.com/economy/2026/5/21/nvidia-posts-record-profit-and-revenue-amid-ai-chip-boom",
        "note": "HBM·AI 인프라 모멘텀 연장"
      },
      {
        "rank": "07",
        "category": "거시",
        "categoryStyle": "default",
        "sentiment": "neg",
        "title": "미시간 소비심리 44.8 — 70년 만의 최저, 인플레 체감 최악",
        "summary": "5월 말 소비자 심리 최종치가 사상 최저를 경신해 PCE 발표 전 경기둔화 신호가 쌓이고 있어요.",
        "source": "Bloomberg",
        "sourceUrl": "https://www.bloomberg.com/news/articles/2026-05-22/us-consumer-sentiment-slumps-to-record-low-on-inflation-worries",
        "note": "소비주 전망 하향 압력"
      },
      {
        "rank": "08",
        "category": "거시",
        "categoryStyle": "default",
        "sentiment": "neu",
        "title": "美 PCE + GDP 2차 5/28 동시 발표 — 워시 의장 첫 정책 시험대",
        "summary": "4월 PCE 헤드라인 전망치는 4.5%, 근원 3.4%로 Fed 목표(2%)와 괴리가 크고 GDP 2차 추정치도 같은 날 나와 시장 충격이 배가될 수 있어요.",
        "source": "CNBC",
        "sourceUrl": "https://www.cnbc.com/2026/05/22/stock-market-next-week-outlook-for-may-25-29-2026.html",
        "note": "인플레 서프라이즈 시 채권·달러 급반응"
      },
      {
        "rank": "09",
        "category": "정책",
        "categoryStyle": "default",
        "sentiment": "neg",
        "title": "EU 성장률 전망 0.9%로 하향 — 이란전쟁 에너지 쇼크 반영",
        "summary": "유럽 집행위원회가 2026년 성장률을 1.4%에서 0.9%로 낮추고 인플레 전망도 3%로 올렸어요. 유로존 스태그플레이션 우려가 커졌어요.",
        "source": "Crestwood Advisors",
        "sourceUrl": "https://www.crestwoodadvisors.com/may-2026-economic-and-market-update/",
        "note": "유럽 증시 하방 리스크"
      },
      {
        "rank": "10",
        "category": "지정학",
        "categoryStyle": "geo",
        "sentiment": "neg",
        "title": "美, 중국 '티팟' 정유사 추가 제재 — 이란산 원유 구입 연루",
        "summary": "미국이 이란 제재 위반 혐의로 중국 소규모 정유사에 2차 제재를 부과해 미·중 갈등의 새 전선이 열렸어요.",
        "source": "CNBC",
        "sourceUrl": "https://www.cnbc.com/2026/04/25/us-china-sanctions-iran-oil.html",
        "note": "미중 관계 추가 냉각 변수"
      },
      {
        "rank": "11",
        "category": "기업",
        "categoryStyle": "default",
        "sentiment": "neu",
        "title": "5/27(화) 美 소비자신뢰지수 + AutoZone 실적 — 재개장 첫 이벤트",
        "summary": "3일 연속 공백 후 재개장 다음 날 소비 관련 지표·실적이 연달아 공개돼 휴장 후 변동성 트리거가 될 수 있어요.",
        "source": "CNBC",
        "sourceUrl": "https://www.cnbc.com/2026/05/22/stock-market-next-week-outlook-for-may-25-29-2026.html",
        "note": "재개장 초반 방향성 지표"
      },
      {
        "rank": "12",
        "category": "거시",
        "categoryStyle": "default",
        "sentiment": "neu",
        "title": "中 5월 PMI 5/30 발표 — 이란전쟁 공급망 영향 첫 공식 지표",
        "summary": "이란 분쟁이 중국 제조업 공급망에 미친 영향이 처음으로 공식 통계로 드러날 예정이에요. LPR 동결 지속 배경과 맞물려 봐야 해요.",
        "source": "Investing.com",
        "sourceUrl": "https://www.investing.com/economic-calendar",
        "note": "글로벌 공급망 리스크 점검"
      }
    ],
    "domestic": [
      {
        "rank": "01",
        "category": "증시제도",
        "categoryStyle": "default",
        "sentiment": "neu",
        "title": "KRX 부처님오신날 대체공휴일 휴장 — 5/26(화) 재개",
        "summary": "5/24 일요일과 겹쳐 월요일(5/25)이 대체공휴일로 지정돼 주식·ETF·채권 모든 거래가 중단됐어요. 3일 연휴 뒤 화요일 재개장이에요.",
        "source": "Daum",
        "sourceUrl": "https://v.daum.net/v/20260525015737667",
        "note": "재개장 초반 변동성 주의"
      },
      {
        "rank": "02",
        "category": "정책",
        "categoryStyle": "default",
        "sentiment": "pos",
        "title": "국민성장펀드 2주차 5/26부터 — 코스닥 첨단산업 60% 의무 매집 재개",
        "summary": "연휴 공백 이후 자펀드 자금이 다시 첨단산업에 풀리며 코스닥 중소형 강세 흐름이 이어질지 주목돼요.",
        "source": "금융위원회",
        "sourceUrl": "https://www.fsc.go.kr/no010101/86834",
        "note": "2차전지·AI 부품 직접 수혜"
      },
      {
        "rank": "03",
        "category": "통화정책",
        "categoryStyle": "default",
        "sentiment": "neu",
        "title": "한은 금통위 5/28 — 기준금리 2.50% 동결 유력, 인상 소수의견 가능",
        "summary": "물가 압력 확대로 인상 소수의견이 등장할 수 있고 점도표 상단 상향 논의도 재점화될 수 있어요. PCE 직전이라 글로벌 변수와 연동돼요.",
        "source": "한국경제",
        "sourceUrl": "https://www.hankyung.com/article/2026041013967",
        "note": "통화정책 전환점 가능성"
      },
      {
        "rank": "04",
        "category": "정책",
        "categoryStyle": "default",
        "sentiment": "neu",
        "title": "한미 관세 2차 기술협의 착수 — 자동차·철강·반도체 본격 논의",
        "summary": "한미 FTA 시절 0.2%였던 실효 관세율이 12.3%로 급등한 상황에서 6월 '2+2 통상협의' 목표로 기술협의가 시작됐어요.",
        "source": "연합뉴스TV",
        "sourceUrl": "https://www.msn.com/ko-kr/news/other/%ED%95%9C%EB%AF%B8-%EA%B4%80%EC%84%B8%ED%98%91%EC%83%81-%EC%9D%B4%EB%B2%88%EC%A3%BC-%EB%B6%84%EC%88%98%EB%A0%B9-%EC%83%81%ED%98%B8-%ED%92%88%EB%AA%A9%EA%B4%80%EC%84%B8-%ED%9D%AC%EB%B9%84-%EA%B0%88%EB%A6%AC%EB%82%98-%EC%97%B0%ED%95%A9%EB%89%B4%EC%8A%A4tv-yonhapnewstv/vi-AA1JomYo?ocid=hpmsn",
        "note": "협상 결과 따라 자동차·철강 주가 방향 갈려"
      },
      {
        "rank": "05",
        "category": "반도체",
        "categoryStyle": "tech",
        "sentiment": "pos",
        "title": "씨티, SK하이닉스 목표주가 310만·삼성전자 46만 대폭 상향",
        "summary": "HBM 선두 지위와 AI 서버 수요를 근거로 씨티가 목표주가를 크게 올렸어요. SK하이닉스 310만·삼성전자 46만원 제시예요.",
        "source": "Investing.com KR",
        "sourceUrl": "https://kr.investing.com/news/stock-market-news/article-1939455",
        "note": "재개장 후 반도체 강세 모멘텀"
      },
      {
        "rank": "06",
        "category": "증시제도",
        "categoryStyle": "default",